{
  "schema_version": "0.1.0",
  "run_id": "RUN-OFS003-PILOT-001",
  "center_id": "CENTER-AIST-IHF",
  "name_ja": "産業技術総合研究所 情報・人間工学領域",
  "name_en": "AIST Information Technology and Human Factors",
  "profile_status": "provisional",
  "evidence_as_of": "2026-08-24",
  "evidence_refs": [
    "EVD-2CDF7DDE0742",
    "EVD-4A8E3CED50AC"
  ],
  "users": {
    "status": "unknown",
    "summary": "No assigned Evidence establishes this field.",
    "as_of": null,
    "evidence_refs": []
  },
  "priority_domains": {
    "status": "verified",
    "summary": "ABCI 3.0 prioritizes advanced AI research, evaluation, and training.",
    "as_of": "2026-08-24",
    "evidence_refs": [
      "EVD-4A8E3CED50AC"
    ]
  },
  "current_system": {
    "status": "partial",
    "summary": "ABCI 3.0 is listed for HPCI, but its FY2026 resource amount was not determined.",
    "as_of": "2026-08-24",
    "evidence_refs": [
      "EVD-2CDF7DDE0742"
    ]
  },
  "refresh_window": {
    "status": "unknown",
    "summary": "No assigned Evidence establishes this field.",
    "as_of": null,
    "evidence_refs": []
  },
  "power": {
    "status": "unknown",
    "summary": "No assigned Evidence establishes this field.",
    "as_of": null,
    "evidence_refs": []
  },
  "facility": {
    "status": "unknown",
    "summary": "No assigned Evidence establishes this field.",
    "as_of": null,
    "evidence_refs": []
  },
  "software": {
    "status": "partial",
    "summary": "An AI-ready software stack and AI Hub service are described, without a complete inventory.",
    "as_of": "2026-08-24",
    "evidence_refs": [
      "EVD-4A8E3CED50AC"
    ]
  },
  "operations": {
    "status": "partial",
    "summary": "AIST describes ABCI 3.0 as an AI-focused cloud platform and publishes priority pricing.",
    "as_of": "2026-08-24",
    "evidence_refs": [
      "EVD-4A8E3CED50AC"
    ]
  },
  "migration": {
    "status": "unknown",
    "summary": "No assigned Evidence establishes this field.",
    "as_of": null,
    "evidence_refs": []
  },
  "data_connectivity": {
    "status": "unknown",
    "summary": "No assigned Evidence establishes this field.",
    "as_of": null,
    "evidence_refs": []
  },
  "unknowns": [
    "data_connectivity",
    "facility",
    "migration",
    "power",
    "refresh_window",
    "users"
  ],
  "created_by_agent_id": "synthesis-public-01",
  "created_at": "2026-08-23T18:37:51.696758Z"
}
