{
  "schema_version": "0.1.0",
  "run_id": "RUN-OFS003-PILOT-001",
  "center_id": "CENTER-KYOTO-ACCMS",
  "name_ja": "京都大学 学術情報メディアセンター",
  "name_en": "Kyoto University Academic Center for Computing and Media Studies",
  "profile_status": "provisional",
  "evidence_as_of": "2026-08-24",
  "evidence_refs": [
    "EVD-5244E80D3AA9",
    "EVD-BDE405CA71F2"
  ],
  "users": {
    "status": "partial",
    "summary": "The service is described as available for nationwide academic use.",
    "as_of": "2026-08-24",
    "evidence_refs": [
      "EVD-5244E80D3AA9"
    ]
  },
  "priority_domains": {
    "status": "partial",
    "summary": "Complementary conventional, large-memory, and AI/ML systems support diverse workloads.",
    "as_of": "2026-08-24",
    "evidence_refs": [
      "EVD-5244E80D3AA9"
    ]
  },
  "current_system": {
    "status": "verified",
    "summary": "Camphor3 is allocated through HPCI in FY2026.",
    "as_of": "2026-08-24",
    "evidence_refs": [
      "EVD-BDE405CA71F2"
    ]
  },
  "refresh_window": {
    "status": "unknown",
    "summary": "No assigned Evidence establishes this field.",
    "as_of": null,
    "evidence_refs": []
  },
  "power": {
    "status": "unknown",
    "summary": "No assigned Evidence establishes this field.",
    "as_of": null,
    "evidence_refs": []
  },
  "facility": {
    "status": "partial",
    "summary": "Four complementary compute systems and shared storage are documented.",
    "as_of": "2026-08-24",
    "evidence_refs": [
      "EVD-5244E80D3AA9"
    ]
  },
  "software": {
    "status": "unknown",
    "summary": "No assigned Evidence establishes this field.",
    "as_of": null,
    "evidence_refs": []
  },
  "operations": {
    "status": "partial",
    "summary": "The center operates a four-system service with storage.",
    "as_of": "2026-08-24",
    "evidence_refs": [
      "EVD-5244E80D3AA9"
    ]
  },
  "migration": {
    "status": "unknown",
    "summary": "No assigned Evidence establishes this field.",
    "as_of": null,
    "evidence_refs": []
  },
  "data_connectivity": {
    "status": "partial",
    "summary": "Shared storage is documented, while external and inter-center paths are not.",
    "as_of": "2026-08-24",
    "evidence_refs": [
      "EVD-5244E80D3AA9"
    ]
  },
  "unknowns": [
    "migration",
    "power",
    "refresh_window",
    "software"
  ],
  "created_by_agent_id": "synthesis-public-01",
  "created_at": "2026-08-23T18:37:51.717739Z"
}
