{
  "schema_version": "0.1.0",
  "proposal_contract_version": "0.2.0",
  "proposal_id": "PRP-CTR-200991",
  "object_type": "center_profile",
  "run_id": "RUN-OFS003-PILOT-002",
  "center_id": "CENTER-UTOKYO-ITC",
  "name_ja": "東京大学 情報基盤センター",
  "name_en": "The University of Tokyo Information Technology Center",
  "profile_status": "provisional",
  "evidence_as_of": "2026-08-24",
  "evidence_refs": [
    "EVD-88C74349E625",
    "EVD-960A5B42E23A",
    "EVD-ECFA9C4080C3"
  ],
  "origin_group_ids": [
    "ORG-283051EA0069",
    "ORG-3420B79093E6",
    "ORG-C41FE0668568"
  ],
  "has_primary_source": true,
  "users": {
    "status": "partial",
    "summary": "The center publishes 2026 general-use fees and application procedures.",
    "as_of": "2026-08-24",
    "evidence_refs": [
      "EVD-960A5B42E23A"
    ]
  },
  "priority_domains": {
    "status": "unknown",
    "summary": "No assigned Evidence establishes this field.",
    "as_of": null,
    "evidence_refs": []
  },
  "current_system": {
    "status": "verified",
    "summary": "Wisteria/BDEC-01 is allocated through HPCI and the center also operates Miyabi.",
    "as_of": "2026-08-24",
    "evidence_refs": [
      "EVD-960A5B42E23A",
      "EVD-ECFA9C4080C3"
    ]
  },
  "refresh_window": {
    "status": "verified",
    "summary": "Miyabi began operation in January 2025.",
    "as_of": "2026-08-24",
    "evidence_refs": [
      "EVD-88C74349E625"
    ]
  },
  "power": {
    "status": "partial",
    "summary": "Miyabi is described as energy efficient in response to decarbonization and energy-price pressure, without a total power figure.",
    "as_of": "2026-08-24",
    "evidence_refs": [
      "EVD-88C74349E625"
    ]
  },
  "facility": {
    "status": "unknown",
    "summary": "No assigned Evidence establishes this field.",
    "as_of": null,
    "evidence_refs": []
  },
  "software": {
    "status": "unknown",
    "summary": "No assigned Evidence establishes this field.",
    "as_of": null,
    "evidence_refs": []
  },
  "operations": {
    "status": "partial",
    "summary": "Current systems and 2026 general-use application routes are documented.",
    "as_of": "2026-08-24",
    "evidence_refs": [
      "EVD-960A5B42E23A"
    ]
  },
  "migration": {
    "status": "partial",
    "summary": "Development built on h3-Open-BDEC knowledge, but application and data migration evidence is incomplete.",
    "as_of": "2026-08-24",
    "evidence_refs": [
      "EVD-88C74349E625"
    ]
  },
  "data_connectivity": {
    "status": "unknown",
    "summary": "No assigned Evidence establishes this field.",
    "as_of": null,
    "evidence_refs": []
  },
  "unknowns": [
    "data_connectivity",
    "facility",
    "priority_domains",
    "software"
  ],
  "created_by_agent_id": "synthesis-public-01",
  "created_at": "2026-08-23T19:01:12.942535Z"
}
