{
  "schema_version": "0.1.0",
  "proposal_contract_version": "0.2.0",
  "proposal_id": "PRP-CTR-265447",
  "object_type": "center_profile",
  "run_id": "RUN-OFS003-PILOT-004",
  "center_id": "CENTER-HOKKAIDO-IIC",
  "name_ja": "北海道大学 情報基盤センター",
  "name_en": "Hokkaido University Information Initiative Center",
  "profile_status": "provisional",
  "evidence_as_of": "2026-08-24",
  "evidence_refs": [
    "EVD-67E01A8122AD",
    "EVD-7195F33F5086",
    "EVD-AD52CD68CE69"
  ],
  "origin_group_ids": [
    "ORG-15F977B43EDF",
    "ORG-5EE1D4F2EDA6",
    "ORG-C41FE0668568"
  ],
  "has_primary_source": true,
  "users": {
    "status": "partial",
    "summary": "The system is described as serving academic and industrial researchers.",
    "as_of": "2026-08-24",
    "evidence_refs": [
      "EVD-67E01A8122AD"
    ]
  },
  "priority_domains": {
    "status": "partial",
    "summary": "The source indicates broad research use but does not quantify workload demand.",
    "as_of": "2026-08-24",
    "evidence_refs": [
      "EVD-67E01A8122AD"
    ]
  },
  "current_system": {
    "status": "verified",
    "summary": "Grand Chariot 2 provides CPU and GPU resources in FY2026.",
    "as_of": "2026-08-24",
    "evidence_refs": [
      "EVD-7195F33F5086"
    ]
  },
  "refresh_window": {
    "status": "partial",
    "summary": "A 32-GPU-node expansion was planned for HPCI availability from April 2027, with an explicit caveat that the plan may change.",
    "as_of": "2026-08-24",
    "evidence_refs": [
      "EVD-AD52CD68CE69"
    ]
  },
  "power": {
    "status": "unknown",
    "summary": "No assigned Evidence establishes this field.",
    "as_of": null,
    "evidence_refs": []
  },
  "facility": {
    "status": "partial",
    "summary": "The published platform combines heterogeneous compute with 16.95 PB of all-flash storage.",
    "as_of": "2026-08-24",
    "evidence_refs": [
      "EVD-67E01A8122AD"
    ]
  },
  "software": {
    "status": "unknown",
    "summary": "No assigned Evidence establishes this field.",
    "as_of": null,
    "evidence_refs": []
  },
  "operations": {
    "status": "partial",
    "summary": "The center describes an operating CPU/GPU service for academic and industrial use.",
    "as_of": "2026-08-24",
    "evidence_refs": [
      "EVD-67E01A8122AD"
    ]
  },
  "migration": {
    "status": "partial",
    "summary": "The proposal expands Grand Chariot 2 rather than describing a full replacement; workload-transition details remain unverified.",
    "as_of": "2026-08-24",
    "evidence_refs": [
      "EVD-AD52CD68CE69"
    ]
  },
  "data_connectivity": {
    "status": "partial",
    "summary": "A 16.95 PB all-flash storage environment is documented; external data-path details remain unverified.",
    "as_of": "2026-08-24",
    "evidence_refs": [
      "EVD-67E01A8122AD"
    ]
  },
  "unknowns": [
    "power",
    "software"
  ],
  "created_by_agent_id": "synthesis-public-01",
  "created_at": "2026-08-23T19:16:44.764768Z"
}
