{
  "schema_version": "0.1.0",
  "run_id": "RUN-OFS003-PILOT-001",
  "center_id": "CENTER-UTOKYO-ITC",
  "name_ja": "東京大学 情報基盤センター",
  "name_en": "The University of Tokyo Information Technology Center",
  "profile_status": "provisional",
  "evidence_as_of": "2026-08-24",
  "evidence_refs": [
    "EVD-960A5B42E23A",
    "EVD-ECFA9C4080C3"
  ],
  "users": {
    "status": "partial",
    "summary": "The center publishes 2026 general-use fees and application procedures.",
    "as_of": "2026-08-24",
    "evidence_refs": [
      "EVD-960A5B42E23A"
    ]
  },
  "priority_domains": {
    "status": "unknown",
    "summary": "No assigned Evidence establishes this field.",
    "as_of": null,
    "evidence_refs": []
  },
  "current_system": {
    "status": "verified",
    "summary": "Wisteria/BDEC-01 is allocated through HPCI and the center also operates Miyabi.",
    "as_of": "2026-08-24",
    "evidence_refs": [
      "EVD-960A5B42E23A",
      "EVD-ECFA9C4080C3"
    ]
  },
  "refresh_window": {
    "status": "unknown",
    "summary": "No assigned Evidence establishes this field.",
    "as_of": null,
    "evidence_refs": []
  },
  "power": {
    "status": "unknown",
    "summary": "No assigned Evidence establishes this field.",
    "as_of": null,
    "evidence_refs": []
  },
  "facility": {
    "status": "unknown",
    "summary": "No assigned Evidence establishes this field.",
    "as_of": null,
    "evidence_refs": []
  },
  "software": {
    "status": "unknown",
    "summary": "No assigned Evidence establishes this field.",
    "as_of": null,
    "evidence_refs": []
  },
  "operations": {
    "status": "partial",
    "summary": "Current systems and 2026 general-use application routes are documented.",
    "as_of": "2026-08-24",
    "evidence_refs": [
      "EVD-960A5B42E23A"
    ]
  },
  "migration": {
    "status": "unknown",
    "summary": "No assigned Evidence establishes this field.",
    "as_of": null,
    "evidence_refs": []
  },
  "data_connectivity": {
    "status": "unknown",
    "summary": "No assigned Evidence establishes this field.",
    "as_of": null,
    "evidence_refs": []
  },
  "unknowns": [
    "data_connectivity",
    "facility",
    "migration",
    "power",
    "priority_domains",
    "refresh_window",
    "software"
  ],
  "created_by_agent_id": "synthesis-public-01",
  "created_at": "2026-08-23T18:37:51.759446Z"
}
